{
  "format": "kotoba.wordlist",
  "version": 1,
  "id": "study-starter-en-zh-hans",
  "title": "学习起步 · AI 英汉小词表",
  "language": "en",
  "translationLanguage": "zh-Hans",
  "source": {
    "name": "Yomiori study-starter — OpenAI AI-generated example",
    "url": "https://openai.com/",
    "license": "CC0 1.0",
    "licenseURL": "https://creativecommons.org/publicdomain/zero/1.0/",
    "attribution": "Definitions, translations and sentences generated by OpenAI AI for this kit; not dictionary quotations or independently verified facts. The source URL identifies the generator project, not a published dictionary or this file. This generated example is offered under CC0 1.0.",
    "modified": false,
    "contentType": "ai-generated"
  },
  "entries": [
    {
      "id": "motivate-v-01",
      "term": "motivate",
      "senses": [
        {
          "partOfSpeech": "verb",
          "definition": "To give someone a reason or desire to do something.",
          "translation": "激励；使有动力"
        }
      ],
      "examples": [
        {
          "text": "A clear goal motivates me to study every day.",
          "translation": "明确的目标激励我每天学习。"
        }
      ],
      "level": "B1",
      "topic": "study",
      "collocations": [
        "motivate someone to learn"
      ],
      "family": [
        "motivation",
        "motivated"
      ],
      "synonyms": [
        "encourage"
      ],
      "tip": "例句 motivates 是 motivate 的第三人称单数形式。",
      "note": "本条由 AI 编写，未经过词典核验。"
    },
    {
      "id": "practice-n-01",
      "term": "practice",
      "senses": [
        {
          "partOfSpeech": "noun",
          "definition": "Repeated activity done to improve a skill.",
          "translation": "练习"
        }
      ],
      "examples": [
        {
          "text": "Daily practice helps me remember new words.",
          "translation": "每天练习有助于我记住新单词。"
        }
      ],
      "level": "A2",
      "topic": "study"
    },
    {
      "id": "curious-adj-01",
      "term": "curious",
      "senses": [
        {
          "partOfSpeech": "adjective",
          "definition": "Wanting to learn or know more about something.",
          "translation": "好奇的；求知欲强的"
        }
      ],
      "examples": [
        {
          "text": "She is curious about how languages change.",
          "translation": "她很好奇语言是如何变化的。"
        }
      ],
      "level": "B1",
      "topic": "learning",
      "antonyms": [
        "uninterested"
      ]
    }
  ]
}
